{
  "$schema": "./atlas.schema.json",
  "contract_version": "1.1.1",
  "provenance": {
    "generated": "2026-08-25",
    "generator": "scripts/atlas_build_bundle.py",
    "generated_by": "OxAlpha (x-preview-f-free)",
    "series_slot": "B1 (H623)",
    "sources": [
      {
        "name": "MEGABOOK.md (Uprava, приватный hub)",
        "commit": "8e1845f8e",
        "sections": [
          "§1.2",
          "§1.4",
          "§6",
          "§8",
          "§9",
          "§11.2",
          "§12.2",
          "§12.3"
        ],
        "visibility": "internal"
      },
      {
        "name": "interlinks_edges.tsv (Uprava, приватный hub)",
        "commit": "a539ae4f6",
        "visibility": "internal"
      },
      {
        "name": "features_index.json (SanskritLexicography, публичный каталог)",
        "visibility": "public"
      }
    ],
    "sanitisation": {
      "denylist_version": "2026-07-11",
      "dropped_nodes": 16,
      "dropped_edges": 26
    }
  },
  "nodes": [
    {
      "id": "asset:cdsl-source-texts",
      "kind": "asset",
      "label_ru": "Тексты словарей CDSL (source spine, v02/<dict>/<dict>.txt)",
      "asset_types": [
        "data"
      ],
      "owner": "repo:csl-orig",
      "url": "https://github.com/sanskrit-lexicon/csl-orig",
      "rights": "open",
      "prohibition_ru": "Не редактировать напрямую; не строить второй коррекционный конвейер.",
      "rule_refs": [
        "7.6",
        "7.7",
        "7.8"
      ],
      "temperature": "structural",
      "evidence": {
        "label_ru": "Карта переиспользования MEGABOOK §12.2 (внутренний Uprava)",
        "visibility": "internal"
      }
    },
    {
      "id": "asset:ci-fanout",
      "kind": "asset",
      "label_ru": "CI и репо-гигиена fan-out (config-driven batch deploy)",
      "asset_types": [
        "workflow"
      ],
      "owner": "repo:cologne",
      "url": "https://github.com/sanskrit-lexicon/COLOGNE",
      "rights": "open",
      "prohibition_ru": "Не писать CI руками per repo; PHP-репо анализирует Semgrep (в CodeQL нет PHP).",
      "rule_refs": [],
      "temperature": "structural",
      "evidence": {
        "label_ru": "Карта переиспользования MEGABOOK §12.2 (внутренний Uprava)",
        "visibility": "internal"
      },
      "feature_ids": [
        "L9"
      ]
    },
    {
      "id": "asset:concordance-core",
      "kind": "asset",
      "label_ru": "Конкорданс словарь↔корпус (ядро matcher + stable locus ID)",
      "asset_types": [
        "schema",
        "code"
      ],
      "owner": "repo:kosha",
      "url": "https://github.com/gasyoun/kosha/blob/main/scripts/concordance_core.py",
      "rights": "quarantine",
      "prohibition_ru": "Не писать второй matcher; stable locus ID не зависит от web-хоста; relaxed/fuzzy match — кандидат до проверки.",
      "rule_refs": [
        "7.19",
        "7.20"
      ],
      "temperature": "structural",
      "evidence": {
        "label_ru": "Карта переиспользования MEGABOOK §12.2 (внутренний Uprava)",
        "visibility": "internal"
      }
    },
    {
      "id": "asset:correction-pipeline",
      "kind": "asset",
      "label_ru": "Коррекционный конвейер словарей (updateByLine, make_xml, generate_dict.sh)",
      "asset_types": [
        "code",
        "workflow"
      ],
      "owner": "repo:csl-pywork",
      "url": "https://github.com/sanskrit-lexicon/csl-pywork",
      "rights": "rights-gated",
      "prohibition_ru": "Не форкать-и-править; исправление = change-файл + месячный пакетный PR; прямые пуши агентов в csl-orig запрещены.",
      "rule_refs": [
        "7.7",
        "7.8"
      ],
      "temperature": "structural",
      "evidence": {
        "label_ru": "Карта переиспользования MEGABOOK §12.2 (внутренний Uprava)",
        "visibility": "internal"
      },
      "feature_ids": [
        "L2"
      ]
    },
    {
      "id": "asset:data-hub",
      "kind": "asset",
      "label_ru": "Data-hub: манифест datasets.json + data-v* релизы",
      "asset_types": [
        "data",
        "schema"
      ],
      "owner": "repo:kosha",
      "url": "https://github.com/gasyoun/kosha/blob/main/data/manifest/datasets.json",
      "rights": "rights-gated",
      "prohibition_ru": "Не встраивать копию dataset без строки манифеста; публичный tier отделен от закрытого; перед релизом — publish-safety.",
      "rule_refs": [
        "7.21",
        "7.26"
      ],
      "temperature": "structural",
      "evidence": {
        "label_ru": "Карта переиспользования MEGABOOK §12.2 (внутренний Uprava)",
        "visibility": "internal"
      }
    },
    {
      "id": "asset:dcs-cdsl-crosswalk",
      "kind": "asset",
      "label_ru": "DCS↔CDSL crosswalk",
      "asset_types": [
        "data"
      ],
      "owner": "repo:csl-apidev",
      "url": "https://github.com/sanskrit-lexicon/csl-apidev/blob/main/simple-search/dcs_xref/dcs_cdsl_xref.tsv",
      "rights": "open",
      "prohibition_ru": "Не пере-выводить joins DCS↔CDSL.",
      "rule_refs": [
        "7.18"
      ],
      "temperature": "structural",
      "evidence": {
        "label_ru": "Карта переиспользования MEGABOOK §12.2 (внутренний Uprava)",
        "visibility": "internal"
      },
      "feature_ids": [
        "C15"
      ]
    },
    {
      "id": "asset:dcs-corpus",
      "kind": "asset",
      "label_ru": "DCS-корпус: SQLite + lemma frequency (канонический ingest)",
      "asset_types": [
        "data"
      ],
      "owner": "repo:visualdcs",
      "url": "https://github.com/gasyoun/VisualDCS",
      "rights": "quarantine",
      "prohibition_ru": "Не ре-парсить CoNLL-U (пять ingest-путей сведены к одному); частотности потреблять, не пересчитывать; UD Tense=Past смешивает аорист/перфект — слой-кандидат.",
      "rule_refs": [
        "7.13",
        "7.14"
      ],
      "temperature": "structural",
      "evidence": {
        "label_ru": "Карта переиспользования MEGABOOK §12.2 (внутренний Uprava)",
        "visibility": "internal"
      }
    },
    {
      "id": "asset:docx-mdx-pipeline",
      "kind": "asset",
      "label_ru": "Word/PDF → MDX книжный конвейер (docx-to-md + rstTable)",
      "asset_types": [
        "workflow",
        "code"
      ],
      "owner": "repo:buhler-sanskrit-book",
      "url": "https://github.com/alexander-myltsev/buhler-sanskrit-book",
      "rights": "open",
      "prohibition_ru": "Не писать еще один Pandoc→MDX конвертер или grid-table рендерер; копии rstTable синхронизируются байт-в-байт.",
      "rule_refs": [],
      "temperature": "structural",
      "evidence": {
        "label_ru": "Карта переиспользования MEGABOOK §12.2 (внутренний Uprava)",
        "visibility": "internal"
      }
    },
    {
      "id": "asset:entry-render",
      "kind": "asset",
      "label_ru": "Python-рендер статей Cologne",
      "asset_types": [
        "code"
      ],
      "owner": "repo:kosha",
      "url": "https://github.com/gasyoun/kosha/blob/main/app/render.py",
      "rights": "open",
      "prohibition_ru": "Не ре-портировать PHP display-движок.",
      "rule_refs": [
        "7.12"
      ],
      "temperature": "structural",
      "evidence": {
        "label_ru": "Карта переиспользования MEGABOOK §12.2 (внутренний Uprava)",
        "visibility": "internal"
      },
      "feature_ids": [
        "L4"
      ]
    },
    {
      "id": "asset:mw-heritage-crosswalk",
      "kind": "asset",
      "label_ru": "MW↔Heritage crosswalk",
      "asset_types": [
        "data"
      ],
      "owner": "repo:sanskritlexicography",
      "url": "https://github.com/gasyoun/SanskritLexicography/blob/master/HeadwordLists/mw_heritage_crosswalk.tsv",
      "rights": "rights-gated",
      "prohibition_ru": "Не ре-хитить сайты INRIA; источник — GitHub-mirror darkone23 (LGPLLR).",
      "rule_refs": [
        "7.17"
      ],
      "temperature": "structural",
      "evidence": {
        "label_ru": "Карта переиспользования MEGABOOK §12.2 (внутренний Uprava)",
        "visibility": "internal"
      },
      "feature_ids": [
        "C14"
      ]
    },
    {
      "id": "asset:mw-roots",
      "kind": "asset",
      "label_ru": "Инвентарь MW-корней (mw_roots.tsv, count-locked)",
      "asset_types": [
        "data"
      ],
      "owner": "repo:csl-orig",
      "url": "https://github.com/sanskrit-lexicon/csl-orig/blob/main/v02/mw/mw_roots.tsv",
      "rights": "open",
      "prohibition_ru": "Никогда не ре-сканировать mw.txt под инвентарь корней; не путать с mw_etymology.tsv (деривация, не инвентарь).",
      "rule_refs": [
        "7.16"
      ],
      "temperature": "structural",
      "evidence": {
        "label_ru": "Карта переиспользования MEGABOOK §12.2 (внутренний Uprava)",
        "visibility": "internal"
      },
      "feature_ids": [
        "B5"
      ]
    },
    {
      "id": "asset:php-endpoints",
      "kind": "asset",
      "label_ru": "PHP dict-web endpoints (getword/servepdf/serveimg)",
      "asset_types": [
        "code"
      ],
      "owner": "repo:csl-websanlexicon",
      "url": "https://github.com/sanskrit-lexicon/csl-websanlexicon",
      "rights": "open",
      "prohibition_ru": "Чинить шаблон и регенерировать, не править пословарные копии; XSS/SQLi-hardening принадлежит шаблону.",
      "rule_refs": [
        "7.11"
      ],
      "temperature": "structural",
      "evidence": {
        "label_ru": "Карта переиспользования MEGABOOK §12.2 (внутренний Uprava)",
        "visibility": "internal"
      },
      "feature_ids": [
        "L3"
      ]
    },
    {
      "id": "asset:sa-ru-alignment",
      "kind": "asset",
      "label_ru": "Sa→Ru выравнивание + TM/TMX (builders публичны, данные — нет)",
      "asset_types": [
        "data"
      ],
      "owner": "repo:sanskritlexicography",
      "url": "https://github.com/gasyoun/SanskritLexicography/blob/master/RussianTranslation/src/build_corpus_lexicon.py",
      "rights": "rights-gated",